{
  "task_type": "trajectory_tracking",
  "road_scene_request": {
    "map_name": "YantaiTrackingField",
    "image_width_px": 1532,
    "image_height_px": 2040,
    "meters_per_pixel": 0.09,
    "north_up": true,
    "speed_kph": 15.0,
    "scene_profile": "agricultural",
    "description": "Prevalidated Yantai agricultural road geometry with a 5 m dirt farm road, an 8 m asphalt rural road and one shared junction. The scene is flat and has no lane markings or traffic lights.",
    "geo_anchor": {
      "latitude": 37.43327171,
      "longitude": 121.5127619,
      "pixel_x": 520.0,
      "pixel_y": 1319.1
    },
    "nodes": [
      {
        "node_id": "n_farm_west",
        "pixel": [
          60.0,
          1337.0
        ]
      },
      {
        "node_id": "n_intersection",
        "pixel": [
          926.0,
          1302.0
        ]
      },
      {
        "node_id": "n_main_south",
        "pixel": [
          860.0,
          2035.0
        ]
      },
      {
        "node_id": "n_main_north",
        "pixel": [
          1515.0,
          245.0
        ]
      }
    ],
    "roads": [
      {
        "road_id": "farm_road_west_to_intersection",
        "start_node": "n_farm_west",
        "end_node": "n_intersection",
        "width_m": 5.0,
        "surface": "dirt",
        "pixel_polyline": [
          [
            60.0,
            1337.0
          ],
          [
            250.0,
            1331.0
          ],
          [
            520.0,
            1319.1
          ],
          [
            760.0,
            1307.0
          ],
          [
            926.0,
            1302.0
          ]
        ]
      },
      {
        "road_id": "main_road_south_to_intersection",
        "start_node": "n_main_south",
        "end_node": "n_intersection",
        "width_m": 8.0,
        "surface": "asphalt",
        "pixel_polyline": [
          [
            860.0,
            2035.0
          ],
          [
            888.0,
            1840.0
          ],
          [
            918.0,
            1600.0
          ],
          [
            940.0,
            1415.0
          ],
          [
            926.0,
            1302.0
          ]
        ]
      },
      {
        "road_id": "main_road_intersection_to_north",
        "start_node": "n_intersection",
        "end_node": "n_main_north",
        "width_m": 8.0,
        "surface": "asphalt",
        "pixel_polyline": [
          [
            926.0,
            1302.0
          ],
          [
            1035.0,
            1045.0
          ],
          [
            1170.0,
            740.0
          ],
          [
            1340.0,
            430.0
          ],
          [
            1515.0,
            245.0
          ]
        ]
      }
    ]
  },
  "road_scene_output_dir": "outputs/yantai_tracking_scene/road_scene",
  "machinery": {
    "type": "tractor",
    "model_file": "vehicle.tractor.tractor",
    "output_file": "outputs/yantai_tracking_scene/templates/default_tractor_physics.json"
  },
  "experiment": {
    "trajectory_csv": "data/trajectory/yantai_quanlujing.csv",
    "processed_csv": "outputs/yantai_tracking_scene/trajectory/yantai_quanlujing_standard.csv",
    "config": {
      "carla_map": "YantaiTrackingField",
      "vehicle_bp": "vehicle.tractor.tractor",
      "vehicle_type": "tractor",
      "output_dir": "results/yantai_tracking_scene/tracking",
      "map_offset_x": 50.0,
      "map_offset_y": -10.0,
      "spawn_z": 2.0,
      "trajectory_flip_y": true,
      "dt": 0.05,
      "apply_agri_physics": true
    }
  },
  "flow_report": "results/yantai_tracking_scene/crewai_flow_report.json"
}
